{
  "id": "cocanberra",
  "name": "CoCanberra",
  "shortName": "CoCanberra",
  "orgType": "cooperative",
  "category": "community",
  "city": "canberra",
  "lat": -35.253,
  "lng": 149.135,
  "focus": "Coops, Commons and Communities Canberra — local hub connecting cooperatives, commons projects, and community organisations in the ACT. Part of NENA network.",
  "scope": "local",
  "founded": null,
  "url": "https://www.neweconomy.org.au/nena-hubs/location/canberra/",
  "how": "neweconomy.org.au (Canberra)",
  "why": "Local cooperative and commons hub in the capital"
}
