{
  "id": "bccm",
  "name": "Business Council of Co-operatives and Mutuals",
  "shortName": "BCCM",
  "orgType": "peak-body",
  "category": "community",
  "city": "sydney",
  "lat": -33.871,
  "lng": 151.205,
  "focus": "Australia's only peak body for co-operatives and mutuals across all industries. 1,700+ active co-ops nationally. Advocacy, research, policy development for the cooperative sector.",
  "scope": "national",
  "founded": 2013,
  "url": "https://bccm.coop/",
  "how": "bccm.coop",
  "why": "Peak body for Australia's 1,700+ cooperatives"
}
