{
  "id": "infoxchange",
  "name": "Infoxchange",
  "shortName": "Infoxchange",
  "orgType": "social-enterprise",
  "category": "community",
  "city": "naarm",
  "lat": -37.825,
  "lng": 144.967,
  "focus": "Technology for social justice since 1989. Built Ask Izzy (service directory for people in crisis). 38,000+ government and community services use their products. Runs Connecting Up (TechSoup partner) providing discounted tech to NFPs.",
  "scope": "national",
  "founded": 1989,
  "url": "https://www.infoxchange.org/au",
  "how": "infoxchange.org",
  "why": "Technology for social justice — 35+ years"
}
