{
  "id": "good-things",
  "name": "Good Things Foundation Australia",
  "shortName": "Good Things",
  "orgType": "nonprofit",
  "category": "community",
  "city": "sydney",
  "lat": -33.867,
  "lng": 151.207,
  "focus": "Digital inclusion — closing the digital divide for 2.5 million excluded Australians. Network of 3,000+ community organisations. Runs Be Connected program for older Australians.",
  "scope": "national",
  "founded": 2017,
  "url": "https://goodthingsaustralia.org/",
  "how": "goodthingsaustralia.org",
  "why": "National digital inclusion infrastructure"
}
