{
  "id": "nena",
  "name": "New Economy Network Australia",
  "shortName": "NENA",
  "orgType": "cooperative",
  "category": "community",
  "city": "naarm",
  "lat": -37.813,
  "lng": 144.971,
  "focus": "Member-owned cooperative building the new economy since 2015. Sector hubs: commons, food systems, finance, housing, energy, democratic governance. Regional hubs including Canberra, Melbourne, Sydney.",
  "scope": "national",
  "founded": 2015,
  "url": "https://www.neweconomy.org.au/",
  "how": "neweconomy.org.au",
  "why": "National cooperative network — commons hub active"
}
